{
  "profile_name": "dusky-local-wh1000xm4-dji",
  "appimage_path": "/home/dusky/.local/bin/WaveLinux.AppImage",
  "bluetooth": {
    "mac": "AC:80:0A:72:BD:10",
    "card_name": "bluez_card.AC_80_0A_72_BD_10",
    "sink_name": "bluez_output.AC_80_0A_72_BD_10.1",
    "preferred_profile": "a2dp-sink",
    "bad_profiles": [
      "headset-head-unit",
      "headset-head-unit-cvsd"
    ],
    "bad_source_name": "bluez_input.AC:80:0A:72:BD:10"
  },
  "mics": {
    "external": "alsa_input.usb-DJI_Technology_Co.__Ltd._Wireless_Mic_Rx_XSP12345678B-01.iec958-stereo",
    "internal": "alsa_input.pci-0000_00_1f.3-platform-skl_hda_dsp_generic.HiFi__Mic1__source"
  },
  "fallback_speaker": "alsa_output.pci-0000_00_1f.3-platform-skl_hda_dsp_generic.HiFi__Speaker__sink"
}
